{
  "artifact_contract": {
    "coefficient_rows": {
      "twiddle_im": 256,
      "twiddle_inv_im": 256,
      "twiddle_inv_re": 256,
      "twiddle_re": 256,
      "window_qw": 256
    },
    "hash_rule": "logical_integer_vector_fixed_width_hex_lf",
    "manifest_file_names": {
      "artifact_index": "artifact_index.json",
      "coeff_manifest": "coeff_manifest.json",
      "frozen_release_manifest": "frozen_release_manifest.json",
      "quality_bounds": "quality_bounds.json",
      "test_vectors": "test_vectors.json"
    },
    "memh_encoding": "fixed_width_lowercase_hex_lf",
    "statistics_file_names": {
      "bin_stats": "bin_stats.csv",
      "frame_stats": "frame_stats.csv",
      "metrics": "metrics.json"
    },
    "stream_file_names": {
      "x_in": "x_in.memh",
      "y_out": "y_out.memh"
    }
  },
  "configuration": {
    "D": 384,
    "F": 15,
    "G": 128,
    "H": 128,
    "L": 256,
    "N": 12,
    "P": 8,
    "PROTECT_DC": 1,
    "PROTECT_NYQ": 0,
    "THR2": "0"
  },
  "contract": {
    "fft_mode": "custom_radix2_dit_bitrev_in_natural_out",
    "rounding_mode": "round_nearest_ties_away_from_zero",
    "tail_policy": "full_tail",
    "threshold_mapping": "raw_thr2"
  },
  "schema": "trecap_phase2_core_config_v1",
  "source_modes": {
    "adc_live": 1,
    "audio_wrapper": 2,
    "bram_replay": 0,
    "diagnostic_source": 3
  },
  "spec_revision": "core_rev_j",
  "telemetry_revision": "telemetry_rev_g",
  "widths": {
    "W_Qw": 16,
    "W_can": 28,
    "W_can_pre": 29,
    "W_fft": 28,
    "W_fft_pre": 29,
    "W_ifft": 36,
    "W_mag2": 56,
    "W_ola": 37,
    "W_tw": 17,
    "W_u": 27,
    "W_z": 36
  }
}
